<?xml version="1.0" encoding="utf-8"?>
<song xmlns="http://21wdh.staszic.waw.pl" xmlns:xsi="http://www.w3.org/2001/XMLSchema-instance" xsi:schemaLocation="http://21wdh.staszic.waw.pl https://spiewaj.com/song.xsd" title="Windą do nieba">
  <alias>Mój piękny panie</alias>
  <text_author>Marek Dutkiewicz</text_author>
  <comment>Piosenka z albumu „Teatr na drodze” (1978), jeden z największych przebojów zespołu 2 plus 1.</comment>
  <composer>Janusz Kruk</composer>
  <artist type="band">2 plus 1</artist>
  <lyric>
    <block type="verse">
      <row important_over="true">Mój piękny panie, <ch a="C"/>raz zobaczony w <ch a="a"/>technikolo<ch a="G"/>rze,</row>
      <row important_over="true"><ch a="F"/>Piszę do pana os<ch a="G"/>tatni <ch a="C"/>list.</row>
      <row important_over="true"><ch a="G"/>Już mi lusterko z tym <ch a="a"/>pana zdjęciem <ch a="F"/>też nie pomoże,</row>
      <row important_over="true"><ch a="C"/>Pora mi dzisiaj do <ch a="G"/>ślubu <ch a="C"/>iść.</row>
    </block>
    <block type="verse">
      <row important_over="never">Mój piękny panie, ja go nie kocham, taka jest prawda,</row>
      <row important_over="never">Pan główną rolę gra w każdym śnie.</row>
      <row important_over="never">Ale dziewczyna przez życie nie może iść całkiem sama,</row>
      <row important_over="never">Życie jest życiem, pan przecież wie.</row>
    </block>
    <block type="chorus">
      <row important_over="true"><ch a="F"/>Już mi <ch a="G"/>niosą suknię z we<ch a="C"/>lonem, <ch a="a"/></row>
      <row important_over="false"><ch a="F"/>Już Cy<ch a="G"/>ganie czekają z mu<ch a="C"/>zyką, <ch a="a"/></row>
      <row important_over="false"><ch a="F"/>Koń do <ch a="G"/>taktu zamiata o<ch a="C"/>gonem, <ch a="a"/></row>
      <row important_over="false"><ch a="F"/>Mendel<ch a="G"/>sonem stukają ko<ch a="C"/>pyta. <ch a="G"/></row>
    </block>
    <block type="verse">
      <row important_over="never">Jeszcze ryżem sypną na szczęście,</row>
      <row important_over="never">Gości tłum coś fałszywie odśpiewa,</row>
      <row important_over="never">Złoty krążek mi wcisną na rękę</row>
      <bis times="3">
        <row important_over="true">I po<ch a="F"/>wiozą mnie <ch a="G"/>windą do <ch a="C"/>nieba. <ch a="G"/></row>
      </bis>
    </block>
    <block type="verse">
      <row important_over="never">Mój piękny panie, z tego wszystkiego nie mogłam zasnąć,</row>
      <row important_over="never">Więc nie mógł mi się pan przyśnić dziś.</row>
      <row important_over="never">I tak odchodzę bez pożegnania, jakby znienacka,</row>
      <row important_over="never">Ktoś między nami zatrzasnął drzwi.</row>
    </block>
    <blocklink blocknb="3"/>
  </lyric>
  <music metre="4/4">
    <guitar barre="0"/>
  </music>
  <album>Teatr na drodze</album>
  <genre>pop</genre>
  <status>
    <done>
      <text/>
      <authors/>
      <chords>chord positioning</chords>
    </done>
    <verificators>
      <verificator>Krzysiek Cz.</verificator>
      <verificator>https://bibliotekapiosenki.pl/utwory/Winda_do_nieba</verificator>
      <verificator>https://spiewnik.wywrota.pl/dwa-plus-jeden/winda-do-nieba</verificator>
    </verificators>
  </status>
</song>
