<?xml version="1.0" encoding="utf-8"?>
<song xmlns="http://21wdh.staszic.waw.pl" xmlns:xsi="http://www.w3.org/2001/XMLSchema-instance" xsi:schemaLocation="http://21wdh.staszic.waw.pl https://spiewaj.com/song.xsd" title="Madonna">
	<alias>Polsko-ruska madonna</alias>
	<text_author type="solo">Tadeusz Kubiak</text_author>
	<comment></comment>
	<composer type="solo">Józef Kołodziejczyk</composer>
	<artist type="band">Bez Jacka</artist>
	<translator/>
	<original_title/>
	<lyric>
		<block type="chorus">
			<row important_over="true">P<ch a="F"/>olsko-r<ch a="G"/>uska mad<ch a="a"/>onna,</row>
			<row important_over="true">P<ch a="F"/>olsko-st<ch a="G"/>arocerki<ch a="a"/>ewna,</row>
			<row important_over="true"><ch a="F"/> Z gorejąc<ch a="G"/>ego zł<ch a="a"/>ota,</row>
			<row important_over="true">Z ż<ch a="F"/>ywego dr<ch a="G"/>ewna, sr<ch a="a"/>ebra.</row>
		</block>
		<block type="verse">
			<row important_over="true"><ch a="F"/> Bizant<ch a="G"/>yjsko-słowi<ch a="d"/>ańska,</row>
			<row important_over="false"><ch a="F"/> W śnieżnobi<ch a="G"/>ałych suki<ch a="d"/>enkach,</row>
			<row important_over="false"><ch a="F"/> Nie na biel<ch a="G"/>onych pł<ch a="d"/>ótnach,</row>
			<row important_over="true"><ch a="C"/> Na trumiennych d<ch a="G"/>eskach.</row>
		</block>
		<blocklink blocknb="1"/>
		<block type="verse">
			<row important_over="false"><ch a="F"/> Nie boj<ch a="G"/>arska, nie c<ch a="d"/>arska,</row>
			<row important_over="false"><ch a="F"/> Zasmuc<ch a="G"/>ona, kami<ch a="d"/>enna twarz,</row>
			<row important_over="false"><ch a="F"/> Nie boj<ch a="G"/>arska, nie c<ch a="d"/>arska,</row>
			<row important_over="false">Zasmuc<ch a="C"/>ona, chłopska ik<ch a="G"/>ona.</row>
		</block>
		<blocklink blocknb="1"/>
	</lyric>
	<music metre="4/4">
		<guitar barre="0"/>
	</music>
	<keywords/>
	<album>Zatańcz ze mną na polanie</album>
	<genre>Poezja śpiewana</genre>
	<status>
		<done>
			<text/>
			<authors/>
			<chords>chord positioning</chords>
		</done>
		<verificators>
			<verificator>Alek</verificator>
			<verificator>Paweł Budzyński</verificator>
		</verificators>
		<to_do/>
	</status>
	<music_source/>
</song>
