<?xml version="1.0" encoding="utf-8"?>
<song xmlns="http://21wdh.staszic.waw.pl" xmlns:xsi="http://www.w3.org/2001/XMLSchema-instance" xsi:schemaLocation="http://21wdh.staszic.waw.pl https://spiewaj.com/song.xsd" title="Pechowy dzień">
  <alias>Wiatr i chmura</alias>
  <text_author type="solo">Waldemar Chyliński</text_author>
  <comment/>
  <composer type="solo">Waldemar Chyliński</composer>
  <artist type="band">Smutne Skutki</artist>
  <lyric>
    <block type="verse">
      <row important_over="true"><ch a="D"/>Wiatr przystojny w garniturze</row>
      <row important_over="true"><ch a="a"/>chce spodobać się złej chmurze,</row>
      <row important_over="true">chm<ch a="G"/>ura w złości deszczem go przep<ch a="D"/>ędza.</row>
      <row important_over="false"><ch a="D"/>Wiatr się schował w jakimś oknie,</row>
      <row important_over="false">j<ch a="a"/>est szczęśliwy, że nie moknie,</row>
      <row important_over="false"><ch a="G"/>a miał wkrótce chmurze być za m<ch a="D"/>ęża.</row>
    </block>
    <block type="chorus">
      <bis times="2">
        <row important_over="true"><ch a="F"/>Lecz nie jest źl<ch a="C"/>e,</row>
        <row important_over="true"><ch a="A7"/>mogło być g<ch a="d"/>orzej,</row>
        <row important_over="true">czasem w ż<ch a="F"/>yciu zdarza si<ch a="C"/>ę</row>
        <row important_over="true">pechowy dzi<ch a="D"/>eń.</row>
      </bis>
      <row important_over="false" style="instr"><ch a="D"/><ch a="a"/><ch a="G"/><ch a="D"/><ch a="D"/><ch a="a"/><ch a="G"/><ch a="D"/></row>
    </block>
    <block type="verse">
      <row important_over="false"><ch a="D"/>Wiatr szczęśliwy w wolnym stanie,</row>
      <row important_over="false"><ch a="a"/>zawsze stać go na zawianie,</row>
      <row important_over="false">z<ch a="G"/>awsze stać go na samotny sp<ch a="D"/>acer.</row>
      <row important_over="false"><ch a="D"/>A niejedna chmura teraz</row>
      <row important_over="false">k<ch a="a"/>ocha, cierpi i umiera,</row>
      <row important_over="false">m<ch a="G"/>ówiąc: „Wietrze, mogło być in<ch a="D"/>aczej”.</row>
    </block>
    <blocklink blocknb="2"/>
  </lyric>
  <music metre="4/4">
    <guitar barre="0"/>
  </music>
  <keywords/>
  <genre>Piosenka turystyczna</genre>
  <status>
    <done>
      <authors/>
      <chords>chord positioning</chords>
      <text/>
    </done>
    <verificators>
      <verificator>https://spiewnik.wywrota.pl/waldemar-chylinski/pechowy-dzien</verificator>
    </verificators>
  </status>
</song>