<?xml version="1.0" encoding="utf-8"?>
<song title="Dla Michasia" xmlns="http://21wdh.staszic.waw.pl" xmlns:xsi="http://www.w3.org/2001/XMLSchema-instance" xsi:schemaLocation="http://21wdh.staszic.waw.pl https://spiewaj.com/song.xsd">
	<alias>Nie wiedziałem, dobry Boże</alias>
	<text_author type="solo">Aleksandra Bacińska</text_author>
	<comment>Piosenka z repertuaru barda Leonarda Luthera, tytułowa z kasety wydanej na początku lat 90. oraz z płyty „Kraina zagubionych marzeń”.</comment>
	<composer type="solo">Leonard Luther</composer>
	<artist type="solo">Leonard Luther</artist>
	<lyric xmlns="http://21wdh.staszic.waw.pl">
		<block type="verse">
			<row important_over="true">Nie wierz<ch a="D"/>yłem, dobry B<ch a="G"/>oże,</row>
			<row important_over="true">Że się zd<ch a="D"/>arzyć tyle może,</row>
			<row important_over="true">Że cię ki<ch a="G"/>edyś, mały s<ch a="A"/>ynku, będę mi<ch a="D"/>ał.</row>
			<row important_over="true">Spadłeś z ni<ch a="G"/>eba mi ak<ch a="A"/>urat,</row>
			<row important_over="false">Kiedy sz<ch a="D"/>edłem z głową w chm<ch a="G"/>urach —</row>
			<row important_over="true">Niedosp<ch a="D"/>any, skacow<ch a="A"/>any i jak p<ch a="G"/>al<ch a="A"/>ec s<ch a="D"/>am.</row>
		</block>
		<block type="chorus">
			<row important_over="true">Dam Ci pl<ch a="G"/>ecak p<ch a="A"/>ełen m<ch a="D"/>arzeń,</row>
			<row important_over="false">Grać na<ch a="G"/>uczę n<ch a="A"/>a git<ch a="D"/>arze,</row>
			<row important_over="true">Na bar<ch a="G"/>ana Ci<ch a="Fis"/>ę przeni<ch a="h"/>osę<ch a="G"/></row>
			<row important_over="true">Przez świat sm<ch a="D"/>utny j<ch a="A"/>ak kal<ch a="G"/>osze.<ch a="A"/><ch a="D"/></row>
		</block>
		<block type="verse">
			<row important_over="false">Miejsca z<ch a="D"/>agrzać nie umi<ch a="G"/>ałem,</row>
			<row important_over="false">Trochę gr<ch a="D"/>ałem, malowałem,</row>
			<row important_over="false">Życie m<ch a="G"/>i się nieust<ch a="A"/>annie wychyl<ch a="D"/>ało z ram.</row>
			<row important_over="false">Spadłeś z ni<ch a="G"/>eba mi ak<ch a="A"/>urat,</row>
			<row important_over="false">Kiedy sz<ch a="D"/>edłem z głową w chm<ch a="G"/>urach —</row>
			<row important_over="false">Niedosp<ch a="D"/>any, skacow<ch a="A"/>any i jak p<ch a="G"/>al<ch a="A"/>ec s<ch a="D"/>am.</row>
		</block>
		<blocklink blocknb="2"/>
		<block type="verse">
			<row important_over="false">Może ki<ch a="D"/>edyś Ci op<ch a="G"/>owiem,</row>
			<row important_over="false">Kim są l<ch a="D"/>udzie, a kim człowiek,</row>
			<row important_over="false">O jaszcz<ch a="G"/>urkach w skórze k<ch a="A"/>obiet, które s<ch a="D"/>ączą jad.</row>
			<row important_over="false">Może ki<ch a="G"/>edyś — a na r<ch a="A"/>azie</row>
			<row important_over="false">Dam Ci pl<ch a="D"/>ecak pełen m<ch a="G"/>arzeń</row>
			<row important_over="false">I poni<ch a="D"/>osę na bar<ch a="A"/>ana przez parsz<ch a="G"/>yw<ch a="A"/>y świ<ch a="D"/>at.</row>
		</block>
		<blocklink blocknb="2"/>
	</lyric>
	<music metre="4/4">
		<guitar barre="0"/>
	</music>
	<album>Dla Michasia</album>
	<genre>poezja śpiewana</genre>
	<status>
		<done>
			<text/>
			<authors/>
			<chords>chord positioning</chords>
		</done>
		<verificators>
			<verificator>Michał Korch</verificator>
			<verificator>https://spiewnik.wywrota.pl/leonard-luther/dla-michasia</verificator>
		</verificators>
	</status>
</song>
